{
  "$schema": "https://raw.githubusercontent.com/TouristH/UNuse/main/schemas/publisher-manifest-v1.schema.json",
  "manifest_version": 1,
  "id": "io.github.example.toolbox",
  "name": "Example Toolbox",
  "description": "一句话说明插件提供的功能。",
  "authors": [
    "Example"
  ],
  "license": "MIT",
  "repository_url": "https://github.com/example/unuse-toolbox",
  "maintainers": [
    "example"
  ],
  "categories": [
    "utilities"
  ],
  "releases": [
    {
      "version": "1.0.0",
      "channel": "stable",
      "published_at": "2026-08-20T00:00:00Z",
      "release_notes_url": "https://github.com/example/unuse-toolbox/releases/tag/v1.0.0",
      "download": {
        "url": "https://github.com/example/unuse-toolbox/releases/download/v1.0.0/io.github.example.toolbox-1.0.0.zip",
        "sha256": "0000000000000000000000000000000000000000000000000000000000000000",
        "size": 123456
      },
      "api_version": "1.0",
      "minimum_launcher_version": "0.1.0",
      "required_capabilities": [],
      "optional_capabilities": []
    }
  ]
}
